{
  "$schema": "http://json-schema.org/draft-07/schema#",
  "title": "OTTO — questionnaire résiduel de risque",
  "type": "object",
  "required": ["version", "natures_ri", "questions"],
  "properties": {
    "_note": { "type": "string" },
    "version": { "type": "string" },
    "natures_ri": { "type": "object" },
    "questions": { "type": "array", "items": { "$ref": "#/definitions/question" } }
  },
  "definitions": {
    "nature_ri": {
      "type": "object",
      "required": ["libelle", "definition", "sources"],
      "additionalProperties": false,
      "properties": {
        "libelle": { "type": "string", "minLength": 3 },
        "definition": { "type": "string", "minLength": 20 },
        "sources": { "type": "array", "minItems": 1 }
      }
    },
    "question": {
      "type": "object",
      "required": ["code", "portee", "assertion", "nature", "question", "pourquoi", "effet", "sources"],
      "additionalProperties": false,
      "properties": {
        "code": {
          "type": "string",
          "pattern": "^[A-Z_]+$"
        },
        "portee": {
          "enum": ["entite", "section"],
          "description": "entite : posée une fois pour le dossier. section : posée dans chaque section retenue, parce que la réponse peut différer d'un cycle à l'autre. Une portée inconnue tomberait silencieusement du côté « section » — elle arrête l'assemblage."
        },
        "assertion": {
          "enum": ["realite", "exhaustivite", "mesure", "evaluation", "separation", "droits", "presentation"]
        },
        "nature": {
          "type": "string",
          "description": "clé de natures_ri. Une nature absente du registre arrête l'assemblage."
        },
        "question": { "type": "string", "minLength": 30 },
        "pourquoi": {
          "type": "string",
          "minLength": 40,
          "description": "Pourquoi cette question existe ENCORE : ce qu'aucune autre source du dossier ne peut lever. Une question résiduelle sans cette raison écrite est une question de confort."
        },
        "effet": {
          "type": "string",
          "minLength": 40,
          "description": "Ce qu'une réponse « oui » change à l'approche. Une question dont la réponse ne change rien ne doit pas être posée."
        },
        "disparait_quand": {
          "type": "string",
          "minLength": 20,
          "description": "Condition connue qui rendra cette question inutile. Facultatif : certaines questions ne pourront jamais être dérivées du dossier."
        },
        "sources": { "type": "array", "minItems": 1 }
      }
    }
  }
}
